{
  "manifest": 1,
  "id": "winshun.bookmarks",
  "name": {"zh": "浏览器书签", "en": "Browser bookmarks"},
  "version": "1.1.0",
  "description": {"zh": "bm 词：搜 Chrome 和 Edge 的书签，Enter 打开", "en": "bm words: searches Chrome and Edge bookmarks; Enter opens"},
  "author": "LingCore",
  "homepage": "https://github.com/LingCore/WinShun",
  "license": "MIT",
  "runtime": {"mode": "once", "program": "python", "script": "main.py", "debounceMs": 100},
  "permissions": [
    {"files:read": ["%LOCALAPPDATA%\\Google\\Chrome\\User Data\\*\\Bookmarks", "%LOCALAPPDATA%\\Microsoft\\Edge\\User Data\\*\\Bookmarks"]}
  ],
  "commands": [{
    "id": "bm",
    "keyword": ["bm", "sq"],
    "title": {"zh": "书签", "en": "Bookmarks"},
    "description": {"zh": "搜 Chrome / Edge 的书签", "en": "Search Chrome / Edge bookmarks"},
    "icon": "glyph:U+E734",
    "hint": {"zh": "书签的名字或网址里的词", "en": "words of a bookmark's name or address"},
    "cache": {"seconds": 60},
    "ai": {"description": "Search the user's Chrome and Edge bookmarks by words in the title or URL; each item has the title, the folder and the URL (open.url)."}
  }],
  "settings": [
    {"key": "extraFile", "type": "file", "title": {"zh": "另外的书签文件", "en": "Another bookmarks file"}, "hint": {"zh": "Chromium 系浏览器的 Bookmarks 文件（Brave、Vivaldi…），和 Chrome、Edge 的一起搜", "en": "A Chromium browser's Bookmarks file (Brave, Vivaldi …), searched with Chrome's and Edge's"}}
  ],
  "ai": {"expose": true}
}
