{
  "manifest": 1,
  "id": "harafuhub.outlook",
  "name": {"zh": "Outlook 邮件", "en": "Outlook mail"},
  "version": "1.3.0",
  "description": {"zh": "ol 关键词：通过 Windows 搜索索引查找经典 Outlook 的邮件和附件（PDF、Word、Excel 的内容），Enter 打开", "en": "ol <words>: finds classic Outlook mail and its PDF, Word and Excel attachments by content through the Windows Search index; Enter opens"},
  "author": "harafuhub",
  "license": "MIT",
  "runtime": {"mode": "resident", "program": "powershell", "script": "main.ps1", "timeoutMs": 8000, "idleExitSec": 600, "memoryMB": 256},
  "permissions": [],
  "commands": [{
    "id": "mail",
    "keyword": ["ol", "mail"],
    "title": {"zh": "Outlook 邮件", "en": "Outlook mail"},
    "description": {"zh": "搜索主题、正文、发件人和附件内容", "en": "Search subject, body, sender and attachment contents"},
    "icon": "glyph:U+E715",
    "hint": {"zh": "关键词，from: to: in: has:att type:pdf date:7d size:>1mb sort:old", "en": "words, from: to: in: has:att type:pdf date:7d size:>1mb sort:old"},
    "actions": [
      {"id": "open", "title": {"zh": "在 Outlook 中打开", "en": "Open in Outlook"}, "key": "Enter"},
      {"id": "copy", "title": {"zh": "复制主题和发件人", "en": "Copy subject and sender"}, "key": "Ctrl+Enter"},
      {"id": "folder", "title": {"zh": "在 Outlook 中显示文件夹", "en": "Show folder in Outlook"}, "key": "Shift+Enter"}
    ],
    "ai": {"description": "Search the user's local Outlook mail (classic Outlook, through the Windows Search index) and, when words are given, the text of PDF, Word and Excel attachments. Words match subject, body, sender, attachment names and contents as prefixes; filters: from:name, to:name, in:folder, has:attachment, type:pdf|docx|xlsx (attachments only), \"exact phrase\", sort:new|old|size|from|subject, date:today|yesterday|week|month|year|<n>d|2026|2026-10|2026-10-21, after:<date>, before:<date>, size:>1mb|<500kb|1mb-100mb. Empty query lists the newest mails. A mail item's title is the subject, its subtitle sender, date and folder; an attachment item's title is the file name, its subtitle sender, date, mail subject and size; preview is the start of the text."}
  }],
  "settings": [
    {"key": "attachments", "type": "bool", "title": {"zh": "也搜索附件内容（PDF、Word、Excel）", "en": "Also search attachments (PDF, Word, Excel)"}, "hint": {"zh": "有关键词时，附件和邮件一起列出", "en": "Listed beside the mails when you type words"}, "default": true},
    {"key": "sort", "type": "choice", "title": {"zh": "默认顺序", "en": "Default order"}, "options": [
      {"value": "new", "title": {"zh": "最新的在前", "en": "Newest first"}},
      {"value": "old", "title": {"zh": "最早的在前", "en": "Oldest first"}},
      {"value": "size", "title": {"zh": "最大的在前", "en": "Largest first"}},
      {"value": "from", "title": {"zh": "按发件人", "en": "By sender"}},
      {"value": "subject", "title": {"zh": "按主题", "en": "By subject"}}
    ], "default": "new"},
    {"key": "maxRows", "type": "number", "title": {"zh": "最多列出", "en": "Rows at most"}, "default": 50},
    {"key": "includeOther", "type": "bool", "title": {"zh": "也搜索日历、联系人和任务", "en": "Also search calendar, contacts and tasks"}, "hint": {"zh": "这些只能用 Shift+Enter 显示文件夹", "en": "These open their folder only (Shift+Enter)"}, "default": false}
  ],
  "ai": {"expose": true}
}
